{
  "cover_id": "c1",
  "islands": [
    {
      "boundary_in_edges": [],
      "boundary_out_edges": [
        "embed->retrieve"
      ],
      "island_descriptor_ref": "sha256:0000000000000000000000000000000000000000000000000000000000000000",
      "island_id": "i1",
      "member_node_ids": [
        "embed"
      ]
    }
  ],
  "partition_valid": true,
  "schema_version": 1,
  "service": "rag_qa",
  "service_dag_hash": "sha256:0000000000000000000000000000000000000000000000000000000000000000"
}